Name,Tags,Type,Address,Website,Instagram,Description
AKA Rock,Artisan; Prints,Online only,,https://facebook.com/AKAembroidery,,"Hand-embroidered wearable art by Avigail Kolker (AKA Rock), intricate thread drawings stitched one stitch at a time onto tees and vintage garments, where punk spirit meets needle and thread."
Mother of All,Artisan; Luxury,Online only,,https://www.mother-ofall.co.il/,,"A womenswear label launched in 2018 by Noa Pasternak and Golan Taub, inspired by Eve, feminine, strong, and bold. Daring expression meets refined femininity, bold colour and 1980s nostalgia balanced by classic tailoring and clean, elegant silhouettes."
Sabina Musayev,Luxury; Artisan,Online only,,https://sabinamusayev.com/,,"High-quality, beautifully cut pieces made to be worn forever. Sabina Musayev's collections balance sophisticated, casual, and comfortable styles with glamorous evening looks for holidays and special events."
Vanzen,Minimalist; Artisan,Online only,,https://vanzen.co.il/,,"Where style meets serenity. 'VAN' for the sophisticated, innovative spirit of Holland; 'ZEN' for the calm and effortless harmony of Eastern philosophy. A fusion of modern European design with a timeless, restful feel, clothing made to bring both style and inner peace to everyday life."
Two Tone,Size Inclusive; Sustainable; Minimalist,Online only,,https://www.twotone.co.il/,,"Founded in 2014 by Zohar Kalev and Shimon Azkiel, womenswear on a mission, so a woman chooses a piece for her taste, never because it doesn't come in her size. Day-to-night, classic-meets-timeless cuts for every body, produced with real environmental responsibility."
Noritamy,Jewelry; Artisan,Online only,,https://www.noritamy.com/,,"Fashion jewelry handmade in the studio, so no two pieces are exactly alike. Every piece is dipped in a heavy layer of 24K gold or silver tone and is nickel-free, with premium lines and custom-made pieces on request."
AP by Amit Philip,Minimalist; Artisan,Online only,,https://apbyamitphilip.com/,,"Established in 2020 by Amit Philip, a blue-and-white local production designed and made by Amit, building the ultimate everyday wardrobe in a heartbeat, basics with a twist and a unique touch, the pieces everyone needs."
Danit Peleg,Conceptual; Sustainable,Online only,,https://www.danitpeleg.com/,,"A pioneer in 3D-printed fashion, the first designer in the world to create an entire collection on desktop home printers. Coveted, globally exhibited pieces, including a dress for the Rio Paralympics opening ceremony, and a mission to make 3D-printed fashion accessible while cutting waste and pollution."
Masada Jeans,Sustainable; Artisan,Online only,,https://masadajeans.com/,,"Designer Laurent David Vannucci travels the Earth and the seven seas for rare vintage denim, selected for exceptional quality and history, then redesigned, modernised, and re-cut by hand in the Tel Aviv workshop for optimal style and comfort from the first fitting."
Idol Studios,Streetwear; Luxury,Online only,,https://www.idolstudios.co/,,"Israeli luxury streetwear inspired by Jewish heritage, history, and cultural symbols. Limited-edition collections that carry deep meaning and cultural narrative, redefining Jewish pride for those who wear their identity with sophistication and prestige."
Yifat Finkelstein,Menswear; Minimalist,Online only,,https://yifatfinkelshtein.com/,,"A menswear label rooted in ease, structure, and quiet precision. Soft tailoring, natural fabrics, and silhouettes that move with the body, living between streetwear and subtle elegance, shaped by the heat and friction between Tel Aviv and Jerusalem."
Latto Velara,Prints; Streetwear,Online only,,https://lattovelara.com/,,"An illustrated wearable-art world by artist Ori Zlotnik, bold all-over prints across clothing, shoes, bags, and home, spanning playful, punky, and darkly whimsical themed collections from Black Cat Syndrome to Rock and Horror."
The Fluff,Lingerie; Minimalist,Store,"8 HaHashmal St, Tel Aviv",https://the-fluff.com/,,"Soft, comfortable, desirable lingerie and tops for the queens of everyday life, designed and made by an all-women team. Built on the belief that every woman has her own 'Fluff', pieces that feel mysterious yet completely everyday, close to the skin."
BIV Street,Footwear; Minimalist,Store,"74 Nahalat Binyamin, Tel Aviv",https://bivstreet.com/,,"A family business born from years of art, design, and the footwear industry. BIV makes all-day-comfort sandals, water-friendly, memory-foam, easy-clean, alongside its own logo socks. Things they like, wear, and stand behind."
Hoko,Minimalist; Artisan,Store,"7 Nitzana St, Tel Aviv-Jaffa",https://www.hoko-studio.com/,@hokostudio,"Womenswear by Hagit Hazan, founded in 2010 after she graduated from Bezalel Academy of Arts and Design. Nonchalant on one hand and feminine on the other, complimentary and sophisticated, designed and made from a Tel Aviv studio."
Lokita,Minimalist; Prints,Online only,,https://lokita.co.il/,,"Womenswear with a 'blue-and-white' soul by designer Moran Avraham. Precise oversized cuts in quality fabrics, finished with original prints, embroidery, and special details, full of style and quietly cool."
Not For Sale,Streetwear; Edgy,Online only,,https://notforsaletlv.com/,@notforsale_tlv,"NFS, a Tel Aviv streetwear institution, both a store stocking global street and sneaker brands and its own house label of graphic hoodies and tees with a raw, local street attitude."
Foof,Swimwear; Artisan,Online only,,https://foof.co.il/,@foof_swimwear,"Handmade swimwear and beachwear founded by Ofir Baram Manor, built so every woman finds her perfect fit. Alongside the house collections, a custom-design service lets you choose the cut, color, and size, with comfort and uncompromising quality at the core."
Mundo,Swimwear; Prints,Online only,,https://mundobeachwear.com/,@mundo_beachwear,"Born from a journey across the globe and inspired by secluded beaches and nature's wildest colors. Designer swimwear and beachwear for women and men, every print designed in-house and produced in strictly limited quantities, because you weren't born to look like everyone else."
Hush Studio,Jewelry; Artisan,Online only,,https://www.hushstudioo.com/,@hush.studiio,"A handmade jewelry studio of earrings, necklaces, bracelets, and rings, spanning a wabi-sabi line that embraces the beautifully imperfect and a curated vintage and rare collection."
Keren Mualem,Prints; Accessories,Online only,,https://www.kerenmualem.com/,@kerenmualem,"A vibrant, art-driven label of boldly printed clothing, shoes, bags, and statement headbands, playful, colorful, and unmistakably its own. Self-pickup from Givatayim."
Akal,Artisan; Sustainable,Online only,,https://www.akalonline.com/en,@akalstudio_,"By designer Michal Mangisto. A timeless collection where each garment tells a story of longing, exile, and roots, anchored in traditional Ethiopian embroidery. Built on fair employment, integrating talented women from the Ethiopian community who hand-embroider each piece."
Addict,Contemporary; Ready-to-Wear,Online only,,https://addictonline.co.il/,@addict_o.n,"A trend-driven online fashion label for women, tops, tailored suits, dresses, jumpsuits, shoes, and accessories, the most must-have pieces refreshed constantly, with a kids line, Little Addict, alongside."